{
  "kind": "external-asset-package",
  "importer": "image",
  "schemaVersion": "1.0.0",
  "source": "sky.hdr",
  "importSettings": {
    "colorSpace": "linear",
    "mipmap": "auto",
    "addressMode": "clamp-to-edge",
    "filterMode": "linear",
    "cubeFaceSize": 512,
    "specularMipLevels": 5
  },
  "subAssets": [
    {
      "guid": "81eec382-392f-5a93-8998-0ecf11ef7990",
      "sourceIndex": 0,
      "kind": "image"
    }
  ]
}
