{
  "schemaVersion": "1.0.0",
  "kind": "external-asset-package",
  "importer": "shader",
  "source": "sprite.wgsl",
  "importSettings": {
    "materialShaderIdentifier": "forgeax::sprite"
  },
  "subAssets": [
    {
      "guid": "1ded8a0b-8df0-45ee-b746-65a0f1aa2301",
      "sourceIndex": 0,
      "kind": "material-shader"
    }
  ],
  "paramSchema": [
    {
      "name": "colorTint",
      "type": "vec4",
      "default": [1.0, 1.0, 1.0, 1.0]
    },
    {
      "name": "region",
      "type": "vec4",
      "default": [0.0, 0.0, 1.0, 1.0]
    },
    {
      "name": "pivotAndSize",
      "type": "vec4",
      "default": [0.5, 0.5, 1.0, 1.0]
    },
    {
      "name": "slicesAndMode",
      "type": "vec4",
      "default": [0.0, 0.0, 0.0, 0.0]
    },
    {
      "name": "baseColorTexture",
      "type": "texture2d"
    }
  ]
}
