{
  "schemaVersion": "1.0.0",
  "kind": "external-asset-package",
  "importer": "shader",
  "source": "blinn-phong.wgsl",
  "importSettings": {
    "materialShaderIdentifier": "learn-render::5-1-blinn-phong"
  },
  "subAssets": [
    {
      "guid": "01935b00-7d8c-7c4e-9f12-345678abcd02",
      "sourceIndex": 0,
      "kind": "material-shader"
    }
  ],
  "paramSchema": [
    {
      "name": "baseColor",
      "type": "color",
      "default": [1.0, 1.0, 1.0, 1.0]
    },
    {
      "name": "baseColorTexture",
      "type": "texture2d"
    }
  ]
}
