{
  "schemaVersion": "1.0.0",
  "kind": "external-asset-package",
  "importer": "shader",
  "source": "alpha-test.wgsl",
  "importSettings": {
    "materialShaderIdentifier": "learn-render::alpha-test"
  },
  "subAssets": [
    {
      "guid": "01999900-0000-0000-0000-000000000001",
      "sourceIndex": 0,
      "kind": "material-shader"
    }
  ],
  "paramSchema": [
    { "name": "baseColor", "type": "color" },
    { "name": "metallic", "type": "f32" },
    { "name": "roughness", "type": "f32" }
  ]
}
