{
  "schemaVersion": "1.0.0",
  "kind": "external-asset-package",
  "importer": "shader",
  "source": "pulse-material.wgsl",
  "importSettings": {
    "materialShaderIdentifier": "my-game::pulse-material"
  },
  "subAssets": [
    {
      "guid": "01935b00-7d8c-7c4e-9f12-345678abcd01",
      "sourceIndex": 0,
      "kind": "material-shader"
    }
  ],
  "paramSchema": [
    { "name": "baseColor", "type": "color" },
    { "name": "metallic", "type": "f32" },
    { "name": "roughness", "type": "f32" }
  ]
}
